title,selftext,date,subreddit
CMV: Firing someone for their behaviour off-duty is unethical and should be illegal,"I hate bigots as much as the next person and understand the desire to track them down, tell their employers about their off-work racism and laugh as they get fired...it's satisfying af. But I also believe when we do this, we take advantage of an unethical system that works against everyone, including us.

Our employers already own and control us when we're at work. Why has it become accepted that they own and control our off-work lives too? People should be able to drink at a party and post risque photos without losing their job over it, provided their weekend debauchery doesn't hinder their performance. And yes, they should also be able to say whatever ugly racist shit they want off the clock. They should be punished by the law in places where that's illegal. But the workplace has no business inserting itself unless that behaviour has happened during work hours, on-premises or in work uniform. 

The argument that ""they're tarnishing their company by representing it poorly"" is BS. Nobody should be expected to represent their workplace 24/7 and if they are, their pay should reflect that.

Why is this legal and why are people okay with it?",2020-05-27 03:56:31,changemyview
"CMV: Automation is destroying life. Large corporations that enable the mass production, packaging, and transportation of essential items are doing more harm than good. Small, local shops should be encouraged instead.","People should avoid the idea of branded and packaged goods for common things like food, toiletries, and cleaning supplies as much as possible. Instead of transporting these necessities across long distances, local production should be supported. This would drop preservative and plastic use, reduce poverty and unemployment, and improve quality of life for people and nature.

Automation has boosted production, but I believe it causes the flow of wealth to funnel towards to fewer, fortunate people. It costs the community more of their wealth because if they had local producers that converted raw materials to equivalent and more natural goods, the community does not pay for transportation or the packing. Modern, first world communities should practice local and natural production.

Science has given us plastic, and plastic proves how useful it can be. But it is misused in the packaging of food and and toiletries. This malpractice is evident in the damages seen in documents of nature and wildlife.

I believe that if I could travel a mile or two from my neighborhood and pick up eggs, fruit, bread, soap, toothpaste, meats, and so on from multiple local vendors, the majority of people would live more successful and happier lives.",2020-05-27 03:29:27,changemyview
CMV: you shouldn't vote blue no matter what,"Actually you shouldn't vote a certain party no matter what, you should keep what I call a purple mentality, all candidates are innocent until proven to be shit 

Now you're obviously going to vote for who you think is best but it shouldn't be a this party only mentality, and now before I get a ""but I don't like any of the folks on the other  side because they don't agree with my views 100%"" response, please understand this is a mentality that promotes division and says you're never going to open up 

Now the honest truth is this, you can't have the government ran on one party alone or their views alone, this leads down a road where everything changes for the good at first for those who voted for them but then it goes downhill, there is a thing as too much liberalism and too much conservativism, there's needs to be balance 

Again, every candidate is innocent until proven to be shit",2020-05-27 03:10:53,changemyview
"CMV: Major platforms for speech should not be censoring speech to ""limit misinformation""","I am not talking about any particular topics on this post.  Platforms that people sometimes rely on for expressing ideas to large groups of people do not have to allow posts of certain topics.  I think that they shouldn't be legally obligated to do anything, however I think it do think it is wrong.  It is especially wrong when these platforms are limiting speech, but referring people to specific places to get information, as they are funneling people to get their information from a place of their choosing, on topics that could potentially be controversial or have conflicting information on them.  In addition, if platforms are limiting speech, they should limit all speech on a topic, not take down some posts and leave others.",2020-05-27 03:01:27,changemyview
CMV: You can actually divide by 0,"Hello!

This is my first post here, i hope it won't get shadowbanned because my account is relatively new and doesn't have much karma. I also apologise for any mathematics terminology errors, English is not my first language.

Everyone knows ""dividing by 0"" problem. One common explanation is one which was popularised by apple assistant, Siri:

""Imagine that you have zero cookies and you split them evenly among zero friends. How many cookies does each person get? See? It doesn’t make sense. And Cookie Monster is sad that there are no cookies, and you are sad that you have no friends""

This take tries to simplify the problem by putting cookies as dividend and your friends as divider, arguing that you can't split x equal 0, by y that doesn't exist. There is one thing wrong with that take though, as you also can't by that logic split cookies (0 or not) between negative amount of friends. Even worse, there is no real life model for dividing by negative numbers (for example 10/-2), but you can actually explain how much cookies any of your not existent friends would get - if you have cookies, you could give each of your non existent friend an infinite amount. If you don't have cookies, i believe then that's 1 similiarly as with 0 power. If that is ""pure"" 0.

There are 2 things i want to mention.

1st is that math is often very abstract, and doesn't always model reality as whole.
Examples are dividing by negative numbers, x to 0 power is 1, negative powers, 0,(9) = 1, imaginary and complex numbers, hyperreal numbers etc.

2nd is, that same as 0 isn't actually real, ∞ is not too, and based on functions and limits i think that:

x/0 is x*∞. And x ∞ is infinity increasing x times, for example 2 ∞ is function f(x)=2x so basically 2,4,8 without end, instead of 1,2,3 without end

0/0 is equal to 0*∞ which is 1

Now how to explain things like 2*0/0? I think it's rather simple. Same as there are different infinities (increasing at different time), there are 'different nulls'. I think 0 has memory. Let's test it. To solve example above, first multiply 2*0. You get 0, but remember it came from 2. If you divide it by 0, you get 2 back.

10∞*0=10=10*0*∞

If we assume both 0s and infinities have 'memory', now it is possible

Change my mind",2020-05-27 03:00:52,changemyview
"CMV: Being transgener doesn't automatically make you brave, it just makes you a another normal person","Let me preface this by stating that I have no issue with someone being homosexual or transgeneder, live your life how ya want, its your life. Whit that being said......being transgender doesn't inherently make you brave. I acknowledge coming out to you friends and family may be extremely difficult and doing so is a brave act but that doesn't make you and extremely brave person. First responders are brave, service members are brave, medical workers are brave. These people are brave because they risk their lives and do so to protect/save others. Being transgender doesn't save or protect others, you're not laying your life on the line for someone else. Being trans isn't brave, its just be being a normal person like everyone else.",2020-05-27 02:33:35,changemyview
CMV: Am I wrong to believe most anti vax people and families have suffered first hand from traumatic experiences caused from vax side effects.,"I know this is a touchy subject and I don’t need others to attempt to change my beliefs. I whole heartily believe vaccines aren’t for everyone. Personally I don’t care whether others get them or not. It’s their choice, so why do most people become so aggressive, hateful and or violent towards everyone who has the slightest bit of different opinion on the matter? Many I know who are anti vax they seem to all have been effected one way or another by their side effects and when they or the family choose to not participate in vaccines people want to burn them at the stake for doing what they believe is right for. People tend to get so hatful over this subject which is why I’ve never openly talked about the matter to friends so explain to me why it’s acceptable to abuse or talk to us as if we’re the spawn of Satan lol we are normal people who do what we find is right, I respect your beliefs so why do we never get that in return.",2020-05-27 02:25:46,changemyview
CMV: Choosing to be a teenage parent is irresponsible.,"I think it's been pretty well established at this point that children raised by teen parents are worse off in life. There are plenty of studies showing that children raised by teenaged parents have higher risks for health problems as infants, low IQs, and even becoming  teenage parents themselves. 

Personally, I think that pregnant teenagers should be able to get an abortion if they want to, or they should put the baby up for adoption, whether that be through an agency or to another family member. I do not, however, support a child being allowed to care for a baby. Most kids under 18 are not emotionally, financially, or mentally prepared to raise a child effectively.

I sympathize with teens who can't get an abortion for whatever reason, or for those who deal with emotional pain from putting their child up for adoption, but I think actively choosing to raise a baby as a child is an irresponsible decision that teens should not be legally allowed to make. I think they should have to prove a plan of action for after the baby's birth, such as arranging an adoption or letting the child be raised by a family member, and if they fail to do so the baby should be automatically taken into the custody of the state.

 I know there are some teen parents who turn out fine, but those really seem to be the exception to the rule and I don't see why anyone should get to gamble with the future of a child because of their own desires at a young age.",2020-05-27 02:12:47,changemyview
CMV: Feminism is mostly fraudulent at this point and Men’s issues don’t get nearly enough attention and that needs to change.,"I tried posting with sources before and the links didn’t work, you’re welcome to fact check my claims and prove me wrong.

 -Men have higher rates of suicide, particularly in teenagers and young adults

-Colleges and companies frequently higher women over men simply for diversity

-Men make up an astounding percentage of military and workplace deaths

-Men are far more often the victims of violent crime (excluding rape and sexual assault) 

-Men are graded harsher than women in schools and jobs

-Men are held to more of a double standard than women are

-Men’s problems are frequently silenced by feminists, while MRA’s almost never do the same

-Men and men’s issues are often laughed at by society and never given a spotlight

-Men are frequently falsely accused of rape and get their lives ruined without a trial

-Most people view actual equality as mysoginistic

-Pop culture always displays men as bumbling children and women as intelligent masters

-Society is okay with suppression of Men’s Rights activists and men themselves but never suppression of women

-Male victims of rape are often excused because ‘There must be an insertion of something into their body’

-Men are treated harsher under the law

-Men have much higher and longer incarceration rates 

And no, I am not calling for people to ignore women’s rights, I am calling for everyone’s rights to be acknowledged, not just those you want.",2020-05-27 02:07:47,changemyview
CMV: Armed uprising is the only way to deal with the US' police issue,"Yet another man senselessly killed by the police. These police officers were being recorded and had onlookers pleaded with them as one cop dug his knee into the back of neck of a downed man. He wasn't responsive and the cop continued to press down on him until he died. All the other cops either helped pin him down or just watch. In a just world, this man could have been saved by armed bystanders killing these cops. 

The bystanders at the scene were completely helpless, and were even threatened with mace when they tried to intervene and save this man's life. And these cops knew that they were not going to be held accountable. They did all this while being filmed. They know the system is on their side. Yes, I knew they were fired. They'll get off on any manslaughter charges and be working again in a different county once everything blows over.

The fact of the matter is that cops need to be afraid of doing stuff like this. Public outrage ain't cutting it. They don't give a fuck. The police unions don't care. The DAs don't care. And there just isn't the political will to force any change because most of this is happening in minority communities who don't have the political power to make any changes. 

This leads me to believe that American civilians need to stand together and arm ourselves. So when cops start doing things like this, they'll be afraid of being killed in the middle of doing it. It's really harsh, but that's how self defense works. I feel like minority communities need to arm themselves against the police and slowly force them out of their neighborhoods. This is really the only option left. Nothing is going to change unless a change is forced via threat of violence. 

There's obviously a ton of downsides to this and I don't think it's pretty. But I'm starting to think it's the only option left.",2020-05-27 01:31:22,changemyview
CMV: Employers should be allowed to select against strong accents when hiring for communication-heavy roles,"When hiring for specific positions, particularly ones with a high degree of spoken interpersonal communication, employers should be allowed to filter candidates based on their accent.

For most listeners, a speaker’s accent forms part of how you perceive what they are saying and  your comprehension of their ideas. If someone has heavily accented speech, relative to the local dialect, customers and co-workers have great difficulty when interacting. If you’re working in a call center role and the customer can’t understand half of what you’re saying, then you won’t be an effective worker, even if on paper everything else is great. Customers could be negatively impacted and your business could suffer all because you couldn’t filter this worker during the hiring process. 

As soon as people hear this opinion, they immediately go to “racist”, but I beg to differ. My opinion applies equally regardless of your skin colour. If you work in Montreal with a deep southern accent that makes you frequently intelligible to the location population, then it would apply in that situation as well. It is up to the firm to decides when an accent becomes an impediment for the given role.

Yes, this would give employers the ability to filter out candidates for certain roles in a grey area where verbal plays a smaller part and does not impede performance in the role. This is a problem; however, I will argue that market forces will deal with these employers in the long run. If you consistently reject quality employees for slightly accented speech in roles where it doesn't matter, then the market will push these high-value employees to competitors.

However, to provide some recourse in the short-term, I would expect the law permitting this behaviour to be defined to the “reasonable” standard. If the position reasonably requires a worker  without an accent that impedes their speech, then it would be valid to select based on that. If you’re hiring for an email-based customer service rep, then the employer would not be allowed to use accent as a filtering criteria. Candidates rejected for accented speech in a role that doesn't justify it could sue for compensation. A judge/jury (depending on local legal system) would determine what is reasonable. It would be up to the employer to determine whether they want to risk adjudication for roles that are in a grey area.",2020-05-27 00:40:43,changemyview
CMV: I don't regret not focusing on my education as much,"I am about to graduate, but it wasn't without struggle. It took longer than four years, and I pretty much fucked around when I was in school.

My GPA is abysmal, but luckily I was able to get some work experience to help build up my resume.

I wasn't the type of person to dedicate effort into school. I got by doing the bare minimum most of the time. I spent most of my time in school just socializing.

When it comes to employment, they train you on the job anyways. Thinking back, maybe I should have been more studious. Now I am not sure.",2020-05-27 00:34:09,changemyview
CMV: The modern Education System hasn't changed as much as it should have since the 1800s,"We invented what we know today as the modern education system in the 1800s to teach young children how to work in factories and do neat, orderly work without stopping for about 8 hours. We made a system that didn't categorise anyone based on needs and intelligence, everyone starts and ends at the same place regardless of the fact that intelligence varies hugely between people. 

Today our system has obviously changed to suit a more broad range of skills to assist in finding a job later in life. If this is the goal, then we have failed. No where do we learn about politics, personal finance, investing, social media, computer science, coding, web design, starting a business, raising a family, international affairs, the news, self defence, controlling anger and using methods like meditation, the best ways to exercise, healthy eating, I could go on. Instead we learn algebra, geology, chemistry, history, English and so on. Aside from completely missing the mark when it comes to what to teach our children, school takes up way to much time. Children should come home and be done with school for the day without having to deal with homework.

I also can't write a post like this without mentioning exams. Research has shown that asking someone to memorize huge amounts of information across 3 or 4 years and then asked them to repeat this information in small, random amounts onto a page in 3 hours is the worst method of teaching. In Ireland where I am from people enter what is called Primary school from ages 3-5 and attend primary school until the age of 12-13. Then they go on to Secondary School for 6 years from 12 up until they are around 18. When the student is 15 they do what is called the Junior Certificate or Junior Cert. They memorize *not learn* everything over those three years and take a huge test in every subject then at 18, after another three years they do the same again. This is such an inefficient system.

My last arguement is the lack of technology used effectively to teach and connect teachers and students to increase the effectiveness of education but I'm pretty sure everyone knows what I'll say on that one so I'll leave it there as I've written a 200 book already :)",2020-05-27 00:09:51,changemyview
CMV: -ists and -phobes should watch more television,"Rational human beings know by now that there is zero reason to be racist, sexist, or any kind of phobe. Literally any amount of time spent with people who look or act differently than you shows that, shocker, they're just people who generally want the same things. Not to get killed for no reason. Food and shelter. The ability to do what they want especially when that activity affects not a single other person. And no one in their right mind wouldn't be upset if these normal human desires were blocked. I think that one way to stop the idiots who don't get this is with television.

Hear me out. There's been a ton of research that shows that what you watch affects you. If you watch a lot of Top Gear, you probably like cars, but you also learn about cars or the places traveled to in the show. This deepens when you look at portrayals of people. If you watch television with solid, non-jokey representation, you are less likely to hate or fear the people represented. If you identify with a tv character, you are much less likely to hate on people who look like them in real life.

Here's one study done on homophobia before and after watching just one movie: [https://www.researchgate.net/publication/323187487\_Positive\_Representation\_of\_Gay\_Characters\_in\_Movies\_for\_Reducing\_Homophobia](https://www.researchgate.net/publication/323187487_Positive_Representation_of_Gay_Characters_in_Movies_for_Reducing_Homophobia)

The study shows that people came out of the movie more likely to identify across sexualities and less likely to engage in rhetoric or actions that would be classified as homophobic.

Watching television featuring people who look and act different than you enables you to identify and understand people who look and act differently. So the solution to the stupidity that is racism, sexism, homophobia, Islamophobia or any of that is to make them watch television with good representation. Which shows have good representation? Look it up, dummy!

Blacks scare you? You're dumb, but watch more tv (Insecure, Black-Ish, Atlanta, Empire)

Don't understand why your sexist jokes keep getting you reported to HR? You're dumb, but watch more tv (Fleabag, Big, Little Lies, Insecure again)

Hate gays? You're dumb, watch tv (Literally anything with Ryan Murphy's name on it, double dip with Black Lightning, Brooklyn 99)

Confused by Muslims? You're dumb, television(Man Like Mobeen, Elite, Superstore)

There is so much media out there, it's almost harder to not watch a show that represents a group ridiculously hated on. Don't be dumb, watch tv.",2020-05-26 23:53:39,changemyview
CMV: Time to Leave Afghanistan,"I don’t care that the Afghanistan government might collapse if the USA leaves. 

I don’t care that the Taliban might seize control. 

I don’t care if some other terrorist group takes over. 

What’s the end game? Help the good guys? How do we know that the “good guys” of today won’t be the “bad guys” of tomorrow? If 20 years isn’t enough, then how much more do we need? 5 more years? 10? 50? 

We’re wasting lives and money. 

I don’t care if we’re seen as a the “losers” or that we lost the war. We’d be even bigger losers if we waste more money and another 20 years there. Time to withdraw from that god forsaken country.",2020-05-26 23:43:52,changemyview
"CMV: If you believe that some people such as drug addicts, should not have kids, then you shouldn't call people who think poor people shouldn't have kids 'monsters'","I guess my view is, I don't see how it makes you a monster for saying that poor people, as in, for example, people in africa who walk miles just to find water, who are starving to voluntarily have kids. Even your average poor american. 

If your reasoning that drug addicts should not have kids is because you believe that the kids will be harmed, and as long as people's reasoning are the same, then why are they any different? many who say the poor shouldn't have kids believe a kid is better off not existing than existing. If you say 'existence' is better than non existence, than the same would apply to drug addicts. 

I guess I just can't see why for some reason when we add economics into it, everything becomes taboo.

Majority of people are ok saying pedophiles should not have kids. But somehow people believe that even the poor are entitled to have kids? Now, I believe that just because someone has a different standard does not mean that they are monsters. I might have a low standard, but someone having a higher standard are not monsters. 

Most of us will also agree that at a certain age, kids, as in teens should not be having kids. If I say well I don't think 16 year olds and under should be having kids, but you say that I don't think 20 and under should be having kids, does that make you a monster because your standard is 'more than mine'

Now, I know people will say 'but how poor is too poor' is like saying 'how abusive is too abusive'. The point isn't whether we enforce it or not. That's not what the cmv is about. the point is, why is one statement ok but another not?",2020-05-26 23:39:29,changemyview
