title,selftext,date,subreddit
CMV: Men have lower sexual value than women,"I know some people are not going to want to wade through a wall of text so I will try to do a short short version followed by my full point, though I think the fuller text is more interesting:  


Men's bodies, looks etc. don't count for much, in and of themselves next to women's. One observation is that women choose or are forced to use their looks and sexuality (sexual capital) to obtain something desired or avoid something unwanted whereas men do not. But generally speaking men Could not, their sexuality isn't prized enough for it to be useful coinage.

If you are a straight man and not exceedingly good looking, rich, famous or in the 99th percentile of confidence and comfort in yourself, you've probably noticed that women don't just hit on you constantly, you don't get approached all the time in public nor in bars. Hell, even if you do do the approaching its a struggle uphill, and there is a waterfall and no footholds or handholds and even if you make it to the top, there is a giant whose sole purpose is to kick you back into the ravine.  


People will object that women also do not get approached all the time. But we know this cannot be true of a lot of women. Personal anecdotes and experiences of mine aside, there are an endless stream of articles complaining specifically about women being approached all the time, at the wrong time, in the wrong place or even in the right place but the woman doesn't feel like being approached.  


And now for the long winded bit:

  

I think a lot of quarrels about the genders with the goal of egalitarianism in the background can be more reasonably approached by admitting that generally speaking, men and women are appraised differently, sexually. When I say sexually I mean romantically, particularly with respect to how much their perceived bodily and facial attractiveness merits, how much their sexual/romantic company is worth and what people are 'willing to exchange, give up or put up with' in order to pass selection tests, meet standards, be in with a shot, win someone over etc etc. 

Part of the reason I hold this view is because I think there is a lot of evidence for it, there is virtually no evidence against it (unless you engage in rhetorical or deliberative summersaults), Because I once fiercely believed the opposite (despite what reality, my ears and eyes should have told me) and last but not least because in almost all cases where people have tried to oppose it, the implicit assumptions in their discourse actually betrayed that they believe it too. 

A simple example in 'traditional dates' (which still exist today to some extent) Man meets woman for a date. Man pays. If their company is of equal value, what is he paying more for? 

An objection might be that women traditionally had lower paying jobs or had less money, but then we should expect a variance with women contributing more the more they earn, with the relationship completely inverted where the woman earns let's say, twice as much as the man. Another objection would be that the man is expressing his power via his financial largesse and although power of magnanimity can be a thing, it seems circular since the 'power' would be to obtain the woman's company, to maker her feel taken care of (in the hopes of romance/sex ). Since men are generally (not in sex or romance, which I want to problematise) considered to have more power, it would lead to the conclusion that women vying for men sexually or romantically is an even bigger power move on their part, but nobody ever asserts that to be the case. 

Let's move to online. On one big dating site, women respond to men 4% of the time while men respond to women 18% of the time^(1) . OkCupid also showed that the curve of men who estimated women's looks matches those women's looks whereas women perceived 80% of the men on the site as 'below average', a reasonable evaluation if men's looks and body are not prized as highly by women as women's looks and body are by men. 

Let's shift gears a look at a feminist lesbian woman who impersonated a man for 18 months and her counter-intuitive (to her) findings: ' 

'If you have never been sexually attracted to women, you will never quite understand the monumental power of female sexuality, except by proxy or in theory, nor will you quite know the immense advantage it gives us over men. Dating women as a man was a lesson in female power, and it made me, of all things, into a momentary misogynist, which I suppose was the best indicator that my experiment had worked. I saw my own sex from the other side, and I disliked women irrationally for a while because of it. I disliked their superiority, their accusatory smiles, their entitlement to choose or dash me with a fingertip, an execution so lazy, so effortless, it made the defeats and even the successes unbearably humiliating. Typical male power feels by comparison like a blunt instrument, its salvos and field strategies laughably remedial next to the damage a woman can do with a single cutting word: no.'2

The Psychologist Roy Baumeister (and others) has put forward the idea that sex functions like a female resource and that market-like effects obtain in hetero relationships. Cultural systems endow female sex with value but regard male sex as worthless (sausage party for e.g.). Put another way, male sexuality cannot usually be 'exchanged' for things in return.^(3) Remember the classic Friends episode where Chandler, echoing Monika, offers to do 'anything she wants in the bedroom' and she rolls her eyes at his debased coinage? Some will object that men are less proficient at giving women orgasms but this is not a serious objection since men are willing to offer and exchange all sorts of tokens for non-orgasmic erotic interactions. Social exchange theory illuminates how the person with lesser interest/investment has more power since the other person needs something they have. 

Evolutionary Psychologists have observed that other animals mate non-randomly and studies show humans prize different things and those things, differently. These patterns are discernible both in the animal kingdom and in humans' cross culturally and across historical time and also across different levels of development, wealth and egalitarian culture: 

'Feingold[\[52\]](https://evolution-institute.org/on-common-criticisms-of-evolutionary-psychology/#_edn52) meta-analytically examined what women ask for and what men advertise in public, real-world personal advertisements and found, as expected, women more than men ask for cues to willingness and ability to provide resources (e.g., 27% of women ask for high socioeconomic status compared to 7% of men). Men who advertise such status-related cues actually receive more responses from women, as well. For example, in a study that experimentally manipulated real-life personal ads, ads placed by men noting they were financially successful elicited the most interest, whereas for women physical attractiveness was the key[\[53\]](https://evolution-institute.org/on-common-criticisms-of-evolutionary-psychology/#_edn53). In a study of Polish personal ads, the top four cues displayed by men that received responses from women were good education, older age, high resource levels, and tall height[\[54\]](https://evolution-institute.org/on-common-criticisms-of-evolutionary-psychology/#_edn54). In a study of mail order brides from Colombia, Russia, and the Philippines, women universally listed ambition, status, and wealth as among their most desired attributes in a future husband[\[55\]](https://evolution-institute.org/on-common-criticisms-of-evolutionary-psychology/#_edn55). ' 

I would like to address some potential objections ahead of time:  


(A) But men focus on looks, youth, beauty  


(My Response): It's not true that men focus only on those things but it is true that men foreground them and see them as less negotiable than other things and instantly respond to them. Rather than overturning my point, this might be a partial explanation for my point. It would generate more questions e.g. why are men so focused on these things? 

(B) Men focus on women's beauty as a stratagem of power, it's not a compliment, men are lucky not to be valued for their looks, body etc  


(My Response) From their current point of view it doesn't feel that way to men. Although it's certainly cruel that women who don't meet beauty standards are less desirable than other women, they'd have to slide down incredibly far to be as undesirable as most men. Even so, it is more of a contextual point, my argument is that men are not valued as much for their looks and body, the argument still holds up even if you make a consequential claim that the resulting benefit is not desirable. Even at that, it's not the case that men who have say a good personality, or a good sense of humour etc but lack many other qualities have an army of women beating down their door.  


(C) But women do desire men's bodies/looks as much, Patriarchal culture stops them from expressing it.

(My Response) This could be true but it's impossible to know and there is a ton of evidence to the other side. We are all influenced by culture, the comparison wouldn't be what are women like, compared to men with no culture/social pressure it would be what are men and women like both of them without social/cultural pressure. Probably different to some extent, but the male emphasis, drive to obtaining sex holds up across culture, across time and in virtually any circumstance you can think of. So there are really two ideas (1) female sexuality is suppressed in it's expression (which I agree with and cannot be denied) and (2) Patriarchal values suppress female sexuality. (2) Has some truth to it but the problem is that male sexuality is also suppressed. It's not usually recognised to be so but you can tell from the angry, outraged and grossed-out reactions to men being openly sexual that it's not a simple binary. For example in the clergy, priests violate their vows more than nuns do even though both have sworn life-changing vows that are a matter higher than life or death in their belief system. Also consider gay men, the most promiscuous gay men are thousands of times more promiscuous than promiscuous gay women. You could make an argument that gay women are sexually repressed by patriarchal culture but this doesn't make a whole lot of sense, patriarchal culture doesn't tell women how to be attracted to other women, how to have sex with other women and it doesn't tell gay men either.   


  


  
Apologies for the length. Please do change my view.

1. [https://www.businessinsider.com/likelihood-of-getting-a-response-in-online-dating-men-vs-women-2013-7?IR=T ](https://www.businessinsider.com/likelihood-of-getting-a-response-in-online-dating-men-vs-women-2013-7?IR=T)

2. [http://www.theguardian.com/world/2006/mar/18/gender.bookextracts](http://www.theguardian.com/world/2006/mar/18/gender.bookextracts)

3. [http://assets.csom.umn.edu/assets/71503.pdf](http://assets.csom.umn.edu/assets/71503.pdf)

[\[52\]](https://evolution-institute.org/on-common-criticisms-of-evolutionary-psychology/#_ednref52) Feingold, A. (1992). Gender differences in mate selection preferences: a test of the parental investment model. *Psychological Bulletin, 112,* 125–139.

[\[53\]](https://evolution-institute.org/on-common-criticisms-of-evolutionary-psychology/#_ednref53) Strassberg, D. S., &amp; English, B. L. (2014). An experimental study of men’s and women’s personal ads. *Archives of Sexual Behavior*, 1-7. DOI: 10.1007/s10508-014-0428-6.

[\[54\]](https://evolution-institute.org/on-common-criticisms-of-evolutionary-psychology/#_ednref54) Pawlowski, B., &amp; Slawomir, K. (2002). The impact of traits offered in personal advertisements on response rates. *Evolution and Human Behavior, 23*, 139-149.

[\[55\]](https://evolution-institute.org/on-common-criticisms-of-evolutionary-psychology/#_ednref55) Minervini, B.P., &amp; McAndrew, F.T. (2006). The mating strategies and mate preferences of mail order brides. *Cross-Cultural Research, 40*, 111-129.",2020-05-24 08:31:02,changemyview
"CMV: Pitbulls are dangerous. They kill/injure more people than any other dog breed. Poor owners may make them worse, they are predisposed to violence in a way few(if any) other dog breeds are. In addition, their size makes them dangerous in a way that smaller breeds are not.","Hello all, I know Reddit loves pitbulls so I know this post might not be very popular. Any time I see a pitbull post on Reddit the comments are guaranteed to be filled with both pro and anti pitbull sentiments, but it's clear which side has more supporters based on the votes (and the fact that the post was popular in the first place). Personally I've always thought pitbulls were cute, and my friend had a pitbull growing up who only ever bit me once and it wasn't that bad, no worse than other dogs I had who would nip when they got excited. I personally have never experienced the level of violence from any dog that I've heard about in the news.

I want to like putbulls. They are a good size, they're sturdy dogs who are happy to go outside and explore the world. They've got lots and energy, big wide smiles and love to play. Who wouldn't enjoy that? However, looking at the statistics and information available to me, it just doesn't seem reasonable to come to the conclusion that pitbulls are a misunderstood breed that carry the same amount of risks that any other similarly sized dog might carry. 

Reasons why I hold this belief:

1.  [https://en.wikipedia.org/wiki/List\_of\_fatal\_dog\_attacks\_in\_the\_United\_States](https://en.wikipedia.org/wiki/List_of_fatal_dog_attacks_in_the_United_States) 
2. Insurance companies penalizing/refusing to cover pitbulls. These are companies that make their money off of risk management. If pitbulls weren't risks/didn't generate proportionally more insurance claims, they wouldn't raise premiums. There's a reason young adult males with sports cars have insane insurance premiums; they're simply a group at higher risk for insurance claims. These companies are not sexist against men, nor do they specifically hate pitbulls. Their business runs on risk management. 
3. The genetic history of  a dog can clearly have large sweeping effects on a dogs behavior. Why is ""every golden retriever"" always happy? Why does every pointer just know to point at birds in bushes? Why do border collies know how to herd sheep as soon as they're able to walk?  Why are chihuahuas so uptight? A dog with a breed history of unrestrained fighting and overwhelming evidence of killing/attacking people is really a smoking gun to me. 

Points that I have already addressed internally:

1. Violent pitbulls are the result of bad owners.
   1. Clearly. We agree on this point. My point is that the dog is predisposed to violence even when trained properly. There are simply too many stories of non-violent pitbulls suddenly snapping and killing a small child. If you'd like examples, feel free to read the list of fatal dog attacks. The majority of small children on that list are killed by pitbulls.
   2. Pitbulls don't only attack their owners. If being a bad pitbull owner meant you got attacked by your dog, fine. You brought it on yourself. But bad owners let their dogs out, they leave them alone with kids, and they bring the dog into public places where the dog does not have the tools to cope with the situation. Bad pitbull owners can accidentally kill or maim other people, and that is just awful. 
2. The majority of pitbulls will never hurt anyone.
   1. Probably. I am attempting to relate the danger of pitbulls to other breeds of dog, not to some absolute measure of danger. 
3. ""Many different breeds are called pitbulls whenever there is a violent attack, pitbulls are not really responsible"".
   1. The ratio of ""pitbull"" attacks to other dogs is simply too high. According to this study [https://www.vetmed.ufl.edu/2016/02/17/dna-studies-reveal-that-shelter-workers-often-mislabel-dogs-as-pit-bulls/](https://www.vetmed.ufl.edu/2016/02/17/dna-studies-reveal-that-shelter-workers-often-mislabel-dogs-as-pit-bulls/) by the University of Florida, pitbulls were correctly identified only 33% to 70% of the time. Even if you reduced the number of violent pitbull attacks by 1/3 (to account for the mislabeling), they would still vastly outnumber other breeds.
4. ""Chihuahas (or any other breed) are actually more prone to violence"". Those breeds may be more violent, but they clearly do not kill or injure in the numbers that pibulls do. I'm sorry if you have a violent chihuahua(or any other breed), that sounds terrible. At least it doesn't weigh 80 lbs!
5. Anecdotal evidence.
   1. Obviously, right? The only personal experience I have of pitbulls is positive, but I can't deny what I see on the internet, in published literature, and on the news. 

&amp;#x200B;

Common anti-pitbull sentiments that I do not agree with:

1. Pitbulls should be outlawed.
   1. No. People who own pitbulls should absolutely not have them taken away. Breed specific legislation is rarely useful or effective anyways.
2. All/most pitbulls should be euthanized.
   1. No. Pitbulls are living creatures. Their lives are less valuable than a persons life, but they are not forfeit. The animals should be treated fairly and humanely, and only euthanized if a situation where any other dog would meet the same fate. 
3. &amp;#x200B;

 I know on this subreddit what often happens when someone's ""view is changed"" is that a commenter is able to find a very specific wording in the original post and refute it by proposing a specific scenario where the original statement may not apply, even if the broad point was not really addressed. The OP is then forced to said ""yeah I guess in that scenario you're right"", and thus they give out a delta. I'm hoping to have my view addressed more directly, and am happy to engage with commenters.  

&amp;#x200B;

Thanks!",2020-05-24 07:53:31,changemyview
"CMV: We are beyond the point of no return when it comes to political differences, and a new sort of civil war is on the horizon.","No one has ever agreed with each other completely, but it's looking more and more to me like these differences are being inflamed to the point of criticality. Every day, I hear from Republicans talking about how the Democrats are evil, and Democrats saying the same about Republicans. When I ask people that I *can* talk to about what can be done to fix this divide, no one has any answers but ""If they are too there point where they believe (X), they're too far gone to debate.""

Well, them what the fuck can we do?!

I don't even want to be open about my own beliefs anymore because I'm scared of what people on both sides of the aisle would think about me.",2020-05-24 06:22:43,changemyview
CMV: I never tip ever,"I want to pay as little as possible that's what makes most sense to me. I work in customer service and would never expect tips as I'm just doing my job.

I feel awkward but good that I am saving money. I have read posts online from servers raging about not getting tipped and they seem very entitled and crazy.

I live in Canada and would only tip if I was on a date or with company since I would be forced to.

I have only dealt with tipping culture in my pizza related needs but I wouldn't do it for other services either I don't think. I dont expect the best service just do your normal job and treat me less important if necessary.

I don't care if they get paid minimum wage like me my own goals and self interests matter the most which means saving money. I have nothing against them personally and they are always very nice.

I doubt my mind can be changed as I have a different moral compass than the average person, but I would like to see if it's possible :D",2020-05-24 05:23:40,changemyview
CMV: I'm supposed to own a military grade weapon,"Ok so when the 2nd Amendment was framed the standard military rifle was a single shot muzzle loading musket and the hunting rifles that the colonists had were single shot muzzle loading muskets that of which makes it that the colonists had a military grade weapon of the time

Now we all know that time has changed and we have  new guns on the market and new military grade weaponry, shouldn't I be allowed to own the same gun any military currently carries because as the well regulated militia it's our job to be able to defend ourselves against tyranny since corruption and military takeover is always a possibility 

Now the reason for the 2nd Amendment is because of a tyrant that wanted to disarm the colonists and because the founding fathers didn't even want a standing military, we were to be the military when the country needed us to be to protect our freedoms and liberties, which is why it Is written ""A well regulated militia, being necessary to the security of a free state, the right of the people to bear arms, shall not be infringed"" this is the very thing that protects the rest of the Constitution and should remain in such a manner

Now I'm not a owner of a AR-15 but instead a guy who owns hunting rifles and wishes to collect historic combat rifles of the World Wars and I'm planning on getting my concealed carry permit

So I guess you now have to change my view on this",2020-05-24 05:21:29,changemyview
"CMV: Trump is right, the media DOES treat him unfairly.",[removed],2020-05-24 04:38:20,changemyview
CMV: Consciousness exists everywhere and is a basic property of matter.,"My view is that pretty much everything is conscious. Plants are conscious, rocks are conscious, tiny bacteria is conscious, etc. I believe this because our complex consciousness seems like an emergent property of our minds, but emergent properties are really just preexisting properties acting in new and complex ways. The consciousness of most things may be very primitive relative to our own, but I think it exists.

The exception is, apparently if you go to objects small enough, they don't take up space, they have some sort of precursor to space. In cases like those, I believe they also have a precursor to consciousness.",2020-05-24 04:21:41,changemyview
CMV: people should sleep with people because they are nice/kind and not by looks or money,"I always hear people complaining about nice guys being upset when women won’t sleep with them. I also find it hypocritical when guys give out about girls not giving them a chance when they won’t go for the fat ones. What if we just removed all these stupid factors that are really only upsetting people and leading to the creation of incels and femcels and just decided to breed a race of kind people. This way all of societies problems such as climate change, poverty, famine and war will all be solved. If everyone is genuinely a good person and working towards the greater good of man kind then all these problems that are caused by corruption and evils will go away. No more racism or homophobia and dictatorships. 

Now how would we decide who is a “nice person” that’s easy if someone is generally an asshole don’t sleep with them. Girls stop going after “bad guys” guys stop going after bitchy girls. There problem solved. The amount of people who complain about there ex being an asshole is TOO DAM HIGH. People are just making the wrong decisions and such society and mankind  is suffering. We need to make baby’s with those who know how to raise baby’s.",2020-05-24 04:02:48,changemyview
CMV: I don’t understand why cheating on your partner completely changes your feelings toward them.,"Look I’m not saying that you should fool around with other people, it’s still a shitty thing to do. But people get cheated on and act like everything has changed, that the person they knew or was married to for potentially years doesn’t exist anymore, as if the whole relationship is a lie. They act like the earth was shattered around them. I understand there’s broken trust/betrayal and you should talk to them about how you feel and what happened and they should be sorry and regretful. I don’t get how u can look at your feelings toward a person you loved and claim you truly loved them, then have those feelings disappear because someone regretfully broke your trust. People say cheating is “zero tolerance” and that if anyone cheats you then you should leave immediately. I don’t think you could love someone truly and deeply and end those feelings for a decision they regret and apologize for. Obviously if there’s a pattern of cheating or they don’t feel bad or regret it then you shouldn’t be together anyway. But letting regretted mistakes ruin an otherwise deep relationship just makes me think you can’t forgive others weakness.
I’d like to reiterate, if you cheated and don’t regret what you did to your partner then your almost definitely an Ahole",2020-05-24 03:56:56,changemyview
