title,selftext,date,subreddit
CMV: there is no reason for Medicine and Dentistry to be separate fields,"Dentistry should be a speciality of medicine and dentists should go through medical school. Dentists already need to have a wide range of knowledge about the body to understand the effect on teeth and other medical specialities need to have knowledge about teeth as they can be important indicators of eating disorders and tooth health had been proven to have a correlation with cardiovascular health.
I don't see why Dentistry needs to be an entirely different field when its relation to medicine is the same as other specialities relation to medicine",2020-05-21 14:23:33,changemyview
"CMV: Modern/mainstream ""country"" music has nothing to do with what country music used to be.","I grew up on country music and listening to ""country"" on the radio nowadays I just can't seem to find how anyone that knows at least some of the older country stuff could think that the kind of music they put out these days is country music.

First of all, I'm talking about mainstream country. I'm aware that there are artists out there who still play country music and some of that may even be kind of popular but most of it is not country music. To me it seems like every singer that has a southern accent is put on the country radio these days. 

I'm not that familiar with music theory or anything but I don't think I have to be to claim that this stuff isn't country music. I have heard some songs that have some elements of country music in it like a steel guitar for example but it still doesn't sound like country music to me. Country isn't the only thing you can play on a steel guitar and country isn't the only genre you can sing as a southern guy. And I know music genres can evolve but it should at least sound a little bit like what the genre used to be. 

I don't even have anything against the music these guys make. It's not my thing but it's alright, that's not what I mean. But I just don't get why you gotta call it country music. It is pop music, that's it. I wouldn't even call it ""pop country"" or something like that cause I just can't seem to find any similarities. 

Maybe that's rather an opinion than a well thought out argument but I'd just like to hear some other peoples thoughts on this. I mean, I can't be the only one that thinks so. 

If you don't know what I'm talking about just turn on the radio or listen to some playlists that claim to feature ""modern country"" or something like that.",2020-05-21 14:13:55,changemyview
CMV: Publicly following these principles will overall reduce unnecessary suffering and improve my well-being," 

1. *Individual actions for Interdependent living*  
—Each adult is responsible for their own mental, emotional, &amp; physical health.    
—We are stronger and safer prioritizing coexisting &gt; fighting  

2. *Use perspective*  
—Everything‘s only from each person's own perspective  

3. *Be open to changing your view*  
—Would you rather be as accurate as you can or be right?  

4. *No talking over each other*  
—Let them know if they're losing your attention  
—Be concise, or no one will want to listen  

5. *0 support for self-victimization*  
— The victim who is able to articulate their situation of victimhood is no longer a victim.  If you’re unwilling to further articulate your situation, then you are part of your problem.  
— I'll listen to anyone vent anything as long as they agree to start trying to fix it with me whenever they're done venting so they don't have to keep feeling that way.  

6.  *Our core of common humanity*  
—If you look deep enough to the core reasons for our behaviors, we want the same things underneath.  Most fights, arguments, &amp; disagreements are simply misunderstandings of this.  
—So if I disagree about something, first ask them to better explain their perspective and listen for the common humanity at the core of it instead of just assuming my interpretation is correct so I can feel right.  

7. *Give helpful criticism*  
—Unhelpful criticism is criticism without a better suggestion  

8. *If I can’t do something, explain where/how I’m stuck or else I’m just giving up.*",2020-05-21 14:06:47,changemyview
"CMV: Tall women are not attractive, and petite women are superior","I (female, 5'10"" tall, 25 y.o., 140 lbs) have been told I am thoroughly undesirable by the majority of men because of my height. I am the height of the average American man. I can imagine this is even more the case for women taller than myself. 

Past boyfriends have chosen petite women in porn and in real life over me. 

Porn shows endless ""petite this, petite that"" in the titles. Have you honestly seen anything with ""tall woman"" in the title that is not a fetish video of some kind? It isn't alluring or desirable to be tall as a woman. 

My lived experience suggests that petite women are superior and valued more than taller women.

Some of the reasons I have heard in talking about why men prefer petite/dislike tall women:

Tall women are not cute, but petite women are. 

Tall women take more work.

Wanting to be bigger than your partner. 

Wanting to be able to pick up your partner and carry them/during sex.

Tall women are manly. 

I want to feel like I'm dating a woman (meaning a short girl), not a man (meaning tall).",2020-05-21 13:56:43,changemyview
CMV: Amazon is not unethical to the point that it deserves boycotting.,"I see many people including family ""boycotting"" amazon. (Of course, they still use sites that are hosted on AWS, and companies like Audible).

I've looked into why Amazon is ""bad"", and it doesn't seem to be any worse than Walmart Supply Chain. The protests and responses to bad conditions are usually things I have seen standard working at any retail store (IE, timed breaks, etc). One in particular was a protest for not giving employees the day off for Ramadan, which the company did give them the day off, but they protested anyway.

A lot of my far-left friends that are boycotting Amazon are doing so based on the above employee protests, along with the ""Tax avoidance"" that Amazon is doing, but it feels like 1. All big companies do that anyway, and legally they are supposed to, and 2: they are carrying forward losses from previous years, and 3: they actually are starting to pay taxes now.

So - am I missing something? Aren't they just another company? Or is there something to what my friends/family are seeing that I'm not?",2020-05-21 13:54:35,changemyview
"CMV: There is nothing wrong with taking small toiletries (like small bottles of shampoo and lotion, etc.) from a hotel room, at least in big chain hotels.",[removed],2020-05-21 13:28:22,changemyview
CMV: Just because the bulk of the elite's wealth is illiquid is not a good reason to oppose an extreme wealth tax,"To start I'd like to acknowledge my understanding of the stock market is limited. But every time I see an extreme wealth tax discussed people argue ""it makes no sense because it's not liquid wealth"".  They talk about how a mass stock sell off would decrease the stock value (and therefore net worth) and ruin the stock market (i think?) . I mean first of all, isn't that actually a good argument for a extreme wealth tax, like doesn't that prove they have too much power and influence over the world? There is nothing from stopping Jeff Bezos from selling all of his stock except himself. Also, couldn't they be taxed every two weeks or a month like everyone else with a paycheck so it's not some annual mass sell off?  I think it's also worth mentioning money and the stock market are systems invented by humans. They literally exist because we all just agree to this rule-set; this rule-set can be changed.  

&amp;#x200B;

From what I understand their physical assets (mansions, yachts, etc.) usually pale in comparison to their net worth, but I still think if they would have to sell these things to pay the tax then they should. They can decide between less stock and less houses each time they need to pay the tax.   

&amp;#x200B;

I would love to better understand the perspective that an extreme wealth tax should not exist because the wealth is illiquid, so please try to change my view.",2020-05-21 13:24:56,changemyview
CMV: Eastern Europeans are not white. It's unfair to label us the same as native French or Americans whose counties profited from colonialism and racist ideology. Slavs need to be recognised as separate and underprivileged.,[removed],2020-05-21 12:48:22,changemyview
CMV: The practices of marriage are important tools for a successful society and ought not be eroded.,"Marriage is not just a wedding day but rather a lifelong active exercise in growing a loving relationship with one's spouse.  Humanity has developed thousands of years worth of concepts, rules, etc. to guide spouses. Most of those rules boil down to practicing patience and kindness towards your spouse before engaging in your own pleasures. 

When individuals become a couple without making a meaningful promise to seriously attempt the practices described above, they do not set themselves up for success. In this context I am defining success as a long lasting environment of love between the spouse's from which the children of the relationship can benefit. 

To be clear, it is not required that one have a religious ceremony or a ceremony at all in order to promise to bind oneself to certain rules.  Some people get married flippantly, and some non-married people dedidacate their lives to their common-law spouse. In my view, the latter is the better of the two.

Some detriments of engaging in romantic partnerships without engaging in the practices described above are:
- easier to succumb to selfish desires and ulrimately hurt the other spouse
- increased likelihood of creating a poor environment for children to grow up in. Ultimately, more criminals.
- court system overrun by family law disputes (waste of taxes) 

Given that romantic partnerships are apparently a part of human existence, there should be a greater focus on educating people on the successful practices of romantic partnerships.  Some religions make you take a course leading up to your marriage. Society would benefit from something like that (but updated for modern application).",2020-05-21 12:46:02,changemyview
"CMV: There wouldn’t be such a stigma against fatty foods, if “fat” (the caloric source) did not share the same word as the adjective of a person being “fat”.","So fats, are just another source of calories, just like protein and carbohydrates (sugars). Yet fats get a really bad rap because they are associated with being fat. Yet, a person can consume almost no fat in their diet, yet still become fat if they consume too many calories from other sources. Think cows. Their diet consisted almost exclusively of grass, yet they can get quite fat.

Yes, your body processes different types of calories differently (protein, carbs, and fats are all processed by your body a little bit differently), but at the end of the day, a person becomes fat of they are taking in more calories than they are burning.

A few months back, I started the low-carb keto diet, and have actually lost weight while having a diet that consists of far more fatty foods than I used to. Because again, fats are just another form of calories, and as long as you are burning more calories than you take in, you will lose weight.

In my experience, lots of carbohydrates are far more indicative of gaining weight, yet there isn’t widespread stigma against carbs.

So my view is that fatty foods have such a stigma because of the association of the noun “fat” with the adjective “fat”. People are often far more concerned about a piece of food being high in fat than they are about apiece or food being high in carbs, even if the piece of food high in carbs has far more overall calories.

If for example, we started calling fats something else, like “lipids”, there wouldn’t be such a stigma against eating foods containing lipids.

Likewise, if the condition of being overweight was called something like being “carby” and having lots of “stored carbs” around your gut, there would be a much greater stigma around eating carbs, instead of fats.

Change my view!",2020-05-21 12:27:35,changemyview
CMV:I don't believe the patriarchy exists.,"In my opinion, it depends on your definition of patriarchy, obviously, most CEO's and (important) politicians and stuff are men, but I definitely don't believe that there is some kind of ""conspiracy"" to keep all of the old values. Like women being paid less, or ""toxic masculinity"". There are obviously a lot of sexist people (in fact, I think most people, me included, have a tiny bit of inherent misogyny or misandry in them, something they don't even really realize). But saying that we need to ""overcome the patriarchy"" sounds kind of ridiculous. And to me, it sometimes feels like a way to blame men for everyone's problems, which is just horribly unfair. I would be glad if someone could either change my view, or explain what others mean with this.",2020-05-21 11:12:28,changemyview
CMV: Average Americans disdain for government workers(non-political) and unions only further weakens the middle class and working poor.,"I find there to be very few publications that view unions in a positive light. Same goes for publications talking about government workers.  If anything there is tons of popular media that is anti union and anti government worker.  I constantly see people vilifying government workers and unions alike on social media.  I really think it’s against the middle and lower classes best interest to do so and only takes power away from them and further puts it into the hands of the rich and powerful.

I say this because many government jobs and almost all union jobs are part of what make up the middle class.  Without those jobs being what they are the middle class would continue to shrink and many of the people complaining about them would be worse off if the jobs were privatized or cut all together.  I believe a rising tide raises all ships and weakening unions and cutting government jobs does has the opposite effect for the middle and lower classes. 

I think this also may be the result of years of anti-union sentiment from public interest groups that don’t agree with unions.",2020-05-21 10:35:02,changemyview
CMV: Atheists who claim they 'respect' your religious beliefs are lying," ""I'm an atheist but I respect your beliefs""

No you don't. You think the whole concept of God and religion is bullshit. You don't actually respect my religious beliefs, you just respect my right to hold those beliefs. They aren't the same thing.

I have a lot of atheist friends who constantly mock/troll religion/religious people on social media all the time and then say ""I respect your beliefs"" when we're conversing face to face about faith and such. People say that just to avoid an argument about religion, not because they actually mean it. I think they should be frank about it and that people shouldn't be offended the moment someone questions/challenges their faith. How can you respect something you don't believe in?",2020-05-21 10:34:14,changemyview
CMV: Newark Airport should never be labeled as “New York” because that is deceptive to travelers.,"Some travel websites will lump JFK Airport and Newark Airport into the same bag by labeling them “New York City Airports”. One way this can happen is by saying “New York - JFK” and then “New York - Newark”.

This is incredibly deceptive because it makes travelers think that Newark is the name of an airport in New York City, and that is just wrong. Newark is located among the smog of *sigh* New Jersey...

Travel websites need to be upfront with travelers. By telling them that Newark is in New York, you are giving them tons of negative effects. Newark has no subway access, it has horrible airlines like United, Spirit, and Frontier (which would never be allowed at New York’s *fabulous* JFK Airport), and it requires a drive through *New Jersey* before ever setting foot in New York.

New Jersey is just not as cool as Queens, and that’s why these websites need to be upfront. The only airports that should be labeled as “New York” are JFK and LaGuardia. As referenced in the movie Mean Girls, “Newark can’t sit with us”. 

New Jersey is responsible for making their state attractive enough for people to willingly fly to their airport. They shouldn’t be riding off of the New York brand and taking away air traffic from the *real* New York Airports.",2020-05-21 10:31:24,changemyview
CMV: All participants of protests against government action or inaction should openly carry firearms,[removed],2020-05-21 09:35:08,changemyview
CMV: Taxes are good and should be raised to increase economic growth,"The general perception is that raising taxes hurts growth with the common reason being that taxes leave individuals/companies with less money to spend. But tax dollars don't just disappear into thin air, the government spends them. So really higher taxes reallocate the decision of where to assign capital in the economy - from the individual/company to the government.

The government having more power to allocate capital is a good thing and leads to higher economic growth because the governments incentive is to grow the economy (bigger economy, more tax revenue) so the government will spend money on things like education (a smarter population contribute more to economic growth) improving healthcare (ill people don't contribute as much to economic growth) long term infrastructure (the kind of projects individuals and companies don't have the capability or will to do), etc. etc.

Giving more power to allocate capital to companies hurts economic growth because large companies are incredibly inefficient and short-term in their thinking (try working in one). Companies incentive is to squeeze as much cash out of the economy as quickly as possible by investing as little cash as possible to then give returns to shareholders (individuals). They have no incentive to fuel long term economic growth.

Giving more power to individuals to allocate capital hurts economic growth because the average individual has no incentive (and would rarely think) to fuel long-term economic growth. The average individual either hoards their wealth or will just assign capital to what they desire to buy at any particular point in time.",2020-05-21 09:07:18,changemyview
CMV: I should vote for Howie Hawkins (Green candidate) in the US presidential election,"Trump is repugnant, let's be clear. In his policies, however, Trump is much closer to Biden than Biden is to Bernie, Merkel, Jeremy Corbyn or any comparable European candidate. The democratic establishment has a interest in the success of someone who acts repugnant being the republican candidate. This makes it easy for them to put forward a candidate one level ""less"" corrupt than the republican candidate; it removes the incentive for them to try to appease the progressive wing. This is because they are constrained to vote for the dem candidate no matter who it is. The neoliberal wing can effectively ignore everyone outside of the establishment in this way.

""If you call yourself a true progressive you'll do everything you can to prevent Trump's election.""

A similar argument was being floated in 2000. Bush was unquestionably a bigger tragedy as a president than Trump because of the conflicts in Iraq and Afghanistan which continue in some form to this day, as well as the expansion of the torture facilities at Guantanamo Bay. Multiple hundreds of thousands of people were killed as a direct result of wars began in the first term of Bush Jr, which for me takes precedent over the ugliness of Trumps' behavior, no matter how inflammatory it is. So the emerging pattern is every election, the moderate wing says ""(GOP candidate) is basically Satan, you're either with us or against us, most important election of our lifetime"" yadda yadda yadda, their candidate loses and they blame it on progressives rather than on their own shitty candidate, and the democratic party never has to evolve. 

The only possible way to get the dems to listen to us it to make them realize we don't ""owe them"" a vote, an attitude which illustrates the deeply-entrenched entitlement of the neoliberal wing. Change my view!",2020-05-21 09:01:09,changemyview
"CMV: Calling creative works ""good"" or ""bad"" is bad communication and should be avoided in rational discourse","The following is about creative works of any genre or medium, be it literature, music, film or other.

We like to judge works as ""good"" or ""bad"". This can be fine in informal chitchat, but in any serious discussion it should be avoided.

When a work is called ""good"", it can mean one or more of the following:

1. It is enjoyable (completely subjective).
2. It is thought-provoking or instructive (highly subjective).
3. It is enjoyable, thought-provoking or instructive to many (popularity). 
4. It is enjoyable, thought-provoking or instructive to many people in a special group whose opinions on the matter are considered especially important (critical/scholarly acclaim). 
5. It remains enjoyable, thought-provoking or instructive to many people long after its creation (enduring popularity). 
6. It obeys a set of ""rules"" for the medium in question (e.g., accurately hitting music notes and rhythms, a logically consistent plot, character growth).
7. It is or was influential in its medium or genre (historical significance).
... and possibly more things that I didn't think of.

The above 7 points are completely different. They may be statistically correlated, sure, but they remain very separate things. So when one person calls a work ""good"" he's saying ""this work has some unspecific combination of the above"". When another person calls the same work ""bad"" he's saying ""this work is lacking in one or more of the above"".

If I'm just chatting casually with my friends and I say ""_Power Rangers_ is awesome"" or ""William Blake is awesome"", that's acceptable, because everyone can figure out I'm probably talking about meaning 1 or 2. But if I want to argue that William Blake is _better_ than _Power Rangers_ or vice versa, then I need to specify exactly which points I'm talking about.

I'm not saying that calling things good or bad is meaningless. I'm saying it is bad communication. It confuses more than it communicates, especially since people get emotionally attached to the notion of ""good"" or ""bad"". Therefore I think people shouldn't use it.

When reading my list above you may nod sagely. But I will claim that most people don't truly get it. When people argue and get angry or smug about which things are good and bad, it's because they don't truly understand what they're talking about. They do truly understand how ambiguous their terms are; they think that ""objective goodness"" is really one thing, and the other guy just gets it wrong. 

An example is the fiction of H. P. Lovecraft. One reader can claim that Lovecraft is a ""good"" writer because he satisfies points 5 and 7. Another can argue Lovecraft is a ""bad"" writer because he fails points 4 and 6. They can keep arguing and miscommunicating because they don't realize they're talking about different things. 

People communicate badly because they've been taught to think in terms of ""good"" and ""bad"". That's why, in serious discourse, people should stop doing it.",2020-05-21 08:37:03,changemyview
"CMV: If you allow yourself to be trapped in a toxic relationship, you don't get to complain","**I know this is a triggering topic, here I am here so you can educate me and change my view.**

For over 10 years, my good friend has been complaining to me about how controlling and terrible her husband is. It started when they were dating, and she raised red flags about him raising his voice at her and denying her from having male friends other than the ones who are his friends/acquaintances.

He was my classmate from school years ago, and although we rarely talk, we know each other so I ""qualify"" as a friendship she's allowed to keep.

A year later after they got engaged, she whined to me privately about how he was such an asshole at times, and she wasn't sure if this was the right move. I outright told her that if she's asking that kinda question, she should hold off the marriage

Welp, they got married anyway, and as you can expect, year after year she moans about how he yells at her, belittles her, controls her every action etc etc. My advise has always been the same: this is the man she chose; if she can't work things out with him, then divorce him. Her reply is always: Well I am sure I can change him OR I still love him! And besides we have kids!

He puts her down with words like, ""Stupid woman, I am in charge here!"" or ""No one wants you. You are in your middle-age!"" or ""You are NOTHING without me!""

Nearly everyday, she whines to me about how restrictive it is, how she can't take it anymore etc etc. I am sick and tired of hearing her complain. Already, her **son** is learning from the father's example and back-talking to her. When I told her that this was because she was too weak to walk away or to stand her ground, she cried and hung up.

Yes I feel bad. But I feel worst for her children who would grow up in a such an environment. I feel bad for them for having such a weak-willed mother.

Change my mind.",2020-05-21 08:32:47,changemyview
