title,selftext,date,subreddit
CMV: Conventional Schooling/Education Track Might be the Wrong Move for this Generation's Kids,"Couple of addendum.  

\- My point of view comes from being in upper/middle class in a developed country and perhaps the scope of my claim might not extend beyond this. 

\- By this generation's kids, I am referring to kids who are under 10 years old.  

\- By conventional schooling/education track, I am referring to raising my kid to be studious in K-12 setting and devoting both financial and emotional support for them to get ahead in life (e.g. extracurricular activities, private tutoring if necessary, SAT prep courses).  In terms of finances, the last estimate that I've read for my country was around spending $200,000 USD from birth to high school for one kid from middle class (I suspect that variance might be large here so this isn't really a sticking point for my stance).

\_\_\_\_\_\_\_\_\_\_\_\_\_\_\_\_\_\_\_\_\_\_\_\_\_\_\_\_\_\_\_\_\_\_\_\_\_\_\_

So now to my main thesis.  Most people work for roughly 40-50 years in their lives from age 25 to around 65-75.  So for a child who is 5 years old, this would entail that his/her working career would span from year 2040 to 2080/2090.   So as a parent, with everything else being equal, you would want your kids to find a profession where they can stay in that field up to year 2080/2090.  

It is my opinion that with advent of AI/automation, a lot of the jobs will disappear and not come back.  I am quite familiar with the field of AI/machine learning and recognize that many of the human skill sets (e.g. writing papers, composing music, creating artwork, playing games) are being surpassed by AI.  If not now, it will in the next 20-30 years.  Now, I recognize that this will also create new jobs, but it is my opinion that the number of new jobs being created will be less than the number of jobs that would be destroyed in the next 10-20 years (I think most of the predictions made by experts support my claim, but this can be a debatable point in countering my argument).  

So then, the question is this.  The path of least resistance is to just imagine that status quo will prevail and raise my kid (I have a 6 year old) in the conventional route that most of my family members have gone with (I am an academic with a PhD in engineering) in the past.  However, it strikes me that this might be a sub-optimal and a poor way of raising my kid given that many of the professions (e.g. law, medicine, engineering) might be different and essentially wiped out from job opportunity when he turns 18-20 years old (to say the last about what would happen 30-40 years from now).  

One alternative solution is for me to just save/invest the money that would have gone to his extracurricular K-12 education (noted as $200,000 USD above) and just give it to him as a starting seed money later on.  In other words, the strategy would be to de-emphasize the need to go to an elite school and completely get out of that rat race altogether from the beginning.   The path of least resistance is to do what everyone else is doing and spend money on education.  But it seems like that might be burning money as in year 2040-2050, there is minimal need for a lawyer, a doctor, an engineer, etc.  

But that is just the financial aspect of it.  It is conceivable that we are living in an age where what you learn through K-12 education becomes completely irrelevant and not really build up to any useful knowledge that can be used for your future profession.  Moreover, there might be a healthy alternative where we just homeschool the kids and let them enjoy life and just dabble into random activities here and there without being limited and stressed by the current educational track that might be a road to nowhere in 20-30 years.  

By my nature, I am not a person to take a bold stance on something like this, so most likely, I will just go with the general tide for my child, but I am skeptical on whether society will be so different in 20-30 years that the current K-12 education and financial burden prompted to put my kid into an elite university would be a big waste of time.  Thoughts?",2020-05-25 16:16:39,changemyview
"CMV: Jo Jorgensen, the Libertarian Party nominee, is our best option for the future of the US in the upcoming election","Let me start this off by saying this: I know that nobody is going to vote for her, or at least not enough people to make a difference. People have been scared of third parties for far too long. Jo Jorgensen is a 63 year old grandmother and a psychologist with a PhD, as well as an MBA. She is an inspiration to women, whereas Trump is an insult and Biden is inappropriate. She wants to end the failed drug war and release all people incarcerated for victimless crimes. She wants to downsize the federal government and eliminate spending from needless agencies (ATF, NSA, stuff like that). She’ll block any new borrowing and give all cabinet secretaries strict budgets to slowly downsize the national debt, which is now $23 trillion. She will pull the US out of all foreign wars, making the US neutral and preventing the loss of life of thousands of good soldiers for the purpose of oil. Speaking of oil, she wants to gradually downsize big oil and coal in favor of nuclear energy and other alternative sources. 

I believe that most republicans and democrats are, by nature, at least somewhat libertarian. Now is the time for a woman president, especially one who is truly qualified. 

Jo provides the perfect rose between two thorns, we defeat Trump and we keep a (likely) dementia patient out of office (who also says racist things and likes little kids to play on his body hair.)

The people need to rise up against the tyrannical two party big government system we have been raised on. One of Washington’s greatest fears was a two party system. This needs media. It needs support. 

TL;DR- Jo Jorgensen is our best option for a president right now, and we need to publicize the option of voting for a third party as a legitimate means of defeating trump.",2020-05-25 16:04:59,changemyview
"CMV: Uncle Iroh from ATLA is the strongest firebender in the series, not Ozai.","It is stated on the show that Ozai is the most powerful firebender in the world. I've always thought this was total bullshit given the evidence we see in the show. 

- Iroh invented the lightning redirection technique which is a HUGE GAME CHANGER against other firebenders. It's not just the invention of this technique that made him stronger. He then teaches it to Zuko who manages to one-up his much more powerful father in a 1v1 fight and escape. While Zuko doesn't outright win the fight, he clearly had the advantage when he redirected the lightning and made his escape. It's even possible Zuko could have killed Ozai then and there using ONLY IROH'S TECHNIQUE. So obviously, Iroh could kill Ozai in a 1v1 if his much weaker and less experienced student could have done it.

- A similar argument can be me made with Aang. But we can even take it a step further because of Combustion Man. Team Avatar is constantly on the run from CM in season 3. He quickly and easily pins down the world's strongest Airbender, one of the 2 strongest earthbenders in the world, and the granddaughter of the most powerful non-bloodbending water bender in the world. He does this regardless of whether it's day (when he's stronger) or night (when he's weaker). Let's compare that to Aang's fight with Ozai. During Sozin's Comet, which gives Ozai 10X HIS NATURAL POWER, Aang is able to quickly and fairly easily defeat Ozai using little more than dodging and Iroh's redirection technique but refuses to win by killing him. LITERALLY 10 OZAIS IS LESS OF A CHALLENGE FOR AANG TO HANDLE ALONE THAN 1 COMBUSTION MAN IS FOR HIM TO HANDLE WITH TEAM AVATAR TO HELP. This alone proves that CM was MORE THAN 10X more powerful than Ozai. As a side note, I'm aware Aang's firebending was also made 10X stronger, but Aang was still a novice firebender (intermediate at best) when this happened, so it's not like Aang became 10X stronger as a bender because of the comet.

As a secondary CMV, I'd say Combustion Man was the second strongest firebender in ATLA. Ozai can have third.",2020-05-25 16:02:06,changemyview
CMV: All non-vegans who condemn PETA are incredibly hypocritical as it does far more for animal rights,"Almost all of the major criticism that PETA faces stems from [this](https://www.theatlantic.com/health/archive/2012/03/petas-terrible-horrible-no-good-very-bad-history-of-killing-animals/254130/) article. The article describes that PETA kills a very high percentage of the animals in its shelters. I do agree that this is obviously a failing on their part and that they definitely could have adopted more. Even though again this doesn't resolve the fact they are killing more animals than they have to be, they do accept all animals, even the ones that are totally unadoptable, meaning that they have no real future but death. In addition the stats from that article are over 9 years old, the ratio of animal deaths in 2019 dropped to only 60% killed. This is not good and an org with such a high budget should be able to do better, don't get me wrong.

However, the shelters are such a small portion of everything PETA does so i would point to [this](https://www.peta.org/about-peta/victories/) and [this](https://www.peta.org/category/miscellaneous-parent/rescued/) link where we see the various activities that PETA has done that are unquestionable beneficial to the cause of animal rights.  Another potential argument that you may bring up that condemns PETA is their radical tactics and donations to the ALP. Firstly, this is bringing up animal rights into the public discourse which gives it more time to be debated and hopefully provide an outcome beneficial  to animal rights. In addition I personally believe that logically, the exploitation of animals is the greatest wrongdoing on the earth right now, so radical tactics are completely justified ( IK almost all of you disagree on me here but i will be doing another CMV on that very soon so we can discuss this then). the last concern  I will address is the idea that PETA believes in total animal liberation (This means the complete abolition of meat, milk, cheese, eggs, honey, zoos, aquariums, circuses, wool, leather, fur, silk, hunting, fishing, and pet ownership). While i do not personally support something this extreme, the very fact that it is brought up shifts the overton window towards animal rights, allowing for more extreme solutions to be presented, even if they are not that extreme. 

Finally i have the crux of my argument. Almost all of the people that criticize peta for killing animals have payed people thousands of dollars to torture and murder animals.  If you don't believe industrial farming is torture, please read through [this](https://animalequality.org/news/why-factory-farming-is-the-largest-cause-of-animal-abuse-in-history/) entire page. According to [this](https://www.beefmagazine.com/beef/average-household-spent-961-meat-eaten-home-2018) the average household spends around $950 on meat products eaten at home, not including dairy or restaurants. I chose this source so you wouldn't think it is anti-meat as it literally comes from beef magazine.  PETA could literally donate money to factory farms and it still wouldn't have as negative of an impact on animals as all the non-vegans who criticize it, and as i have shown above, they do plenty of pro-animal rights activities.  I feel as if people only care about animal rights when it comes to people abusing their pets, but not the massive contribution they make towards prolonging the exploitation and abuse of animals they don't deem cute enough to live.",2020-05-25 15:51:55,changemyview
CMV: CCP should crush Hong Kong resistance and incorporate the city in into the mainland,"Let me preface this text that I consider myself a Communist, so please refrain from challenging my worldview since we wouldn't ever agree. I know that the CCP is not a perfect Communist party, but it is the only one with enough influence that can challenge the dominant, Western liberal-democratic management of the world. So I stand firmly behind its' actions and although I welcome intra-party debate and critique on the principles of democratic centralism, I think outside critique is illegitimate and even harmful in the long run.

With this said, what is these times happening with HK, I think is a good thing. HK should have been under CCP rule to begin with, the only reason they implemented One Country Two Systems principle was because it was British before it and they wanted to gradually incorporate it into the mainland. So it was never meant in the long run to be independent, different or whatever. What is happening was inevitable.

HK's special status is only harmful in the long run, it endangers the country's sovereignity, security and unity. Independence is out of the question, since it's economically too important and if I remember correctly there were polls in the last few decades and they always wanted to stay a part of China.

Having said that, resistance we can see now is only natural. They got used to the liberties they had and it is natural they fight for them. But if they can't be convinced peacefully to submit to CCP's will, they should be forced. I understand that a lot of people will suffer and even die, but these are casualties we have to accept. We won't build a better world without bloodshed, every major revolution in the history was violent, but ultimately it better the existential conditions of most people and made world a better place.

CCP, while not perfect, is the only party with enough geopolitical and economic power that can challenge the dominant Western worldview and decadent bourgeois mindset. Having said that, I believe they should go even further and finish the Great Cultural Revolution that Chairman Mao started, so they can eradicate lingering elements of bourgeois thought that pollutes their society.

If we accept that, we realize that HK is the biggest reactionary threat inside the mainland, so it should be eradicated by force, if it cannot be peacefully re-educated. The masses are clueless and don't know what is best for themselves, so they should not be allowed to make major political decisions and rather let the Party handle them. The Party itself follows principles of democratic centralism, where discussion, debate and critique are allowed and even welcome, but everyone must stand behind the decisions the majority makes. If the protesters want to influence the Party's decisions, let them join and convince them from inside. While I don't think nor want this to happen, let them try, so they cannot accuse how repressive and dictatorial the CCP is.",2020-05-25 15:28:46,changemyview
"CMV: For most people (you likely included), your IQ is a useless number.","**TL;DR - An IQ score does not measure intelligence, it was never meant to measure intelligence, and the term is thrown around so much that it's lost any worth it's had.** 

“IQ” is a term I hear used a lot. And every time I hear it, I die a little inside. To me, IQ is a largely useless metric for three major reasons.

**First, IQ was never meant to measure intelligence.** The original test battery that would become the IQ test was invented in France by [Alfred Binet](https://en.wikipedia.org/wiki/Alfred_Binet) in 1904. Their original purpose wasn’t to measure intelligence; it was to screen young children for learning disabilities. Binet stressed three things about his test: 

1. The tests do not support or rebuff any theory of intelligence.
2. The tests are a diagnostic tool, and the scores are not useful for normal children. This test should not be used to rank average, everyday people in any way. 
3. These tests are for identifying children who need additional assistance. A low score does not mean a child is “beyond help” or should be isolated from the other children.

The tests then made their way to the United States, where the scoring metric was tweaked. (Dividing the final score by the person’s age instead of subtracting the age. Hence, “Intelligence Quotient” or IQ.) The tests then gained popularity in the US as a tool to rank normal, everyday people and to screen incoming immigrants to the country, in order to weed out all of the “morons.” (Scientific term at the time.) The man largely promoting this use of the tests, [Lewis Terman](https://www.verywellmind.com/lewis-terman-biography-2795523), was a huge proponent of Eugenics and believed that IQ was highly dependent on a person's genetics. He notably administered tests in English to Spanish speakers and to uneducated black students, and concluded that their low scores were due to their race. This a pretty questionable history for the IQ test, to say the least. They were never developed to measure intelligence, but they were used and popularized by Eugenicists to justify their views, which were common in scientists at the time.

**Second, IQ tests do not measure intelligence.** This is where I have to inject a my own belief: I believe that “intelligence” is one of those fuzzy, intangible qualities like “beauty” or “leadership.” It only exists in our minds. Sure, we could try to assign a test and a number to it, but it’s impossible to do so without some sort of bias. No ranking of “beauty” is perfect, so no ranking of “intelligence” can be perfect. The IQ test cannot measure “intelligence.” So what does it measure? Well, it’s just a measure of how well you do on the IQ test. **You want to increase your IQ? It’s simple: you study for the IQ test.** Same thing as the SAT or the ACT, they just measure how well you do on those tests. They don’t measure intelligence. And unlike the SAT/ACT, your IQ score has no practical use. No college is looking at your IQ score for admissions. So what's the point of even having an IQ score? You can't use it for anything!

**Third, the term “IQ” has been thrown around so much as to become meaningless**. The original IQ test has seen some resurgence in primary schools for diagnosing developmental disabilities early on. (Huh, using the tests for their intended purpose. Go figure.) But outside of scientific circles, the term is massively overused. People often use “IQ” to refer to general intelligence in a way that’s simplified, because the fuzzy and intangible idea of “intelligence” is too complicated to talk about easily. And then there’s the oh-so-many “IQ tests” you see on Facebook or other social media websites. Those tests are not the original IQ test, and they are not interested in measuring your IQ accurately. Those websites want your traffic. They want you to come to their website, see their ads, and recommend it to your friends. And nobody will recommend it if they got a low score; these “tests” give artificially inflated scores just to puff up their customers’ egos. Even if you believe that IQ tests measure intelligence, the massive number of fake tests that are prevalent on the internet and the fast-and-loose use of the word “IQ” has diluted the term to the point that it is meaningless. 

That is my view. I will never learn my own IQ, because I am a normal everyday person. As such, I believe that number is completely useless to me. **I will change my view if I can be convinced that there is some merit in the average person having an IQ score.**",2020-05-25 15:00:26,changemyview
CMV:human extinction is impossible,"barring some astronomical events like supernovas or gamma bursts, we''re basically ineradicable

nothing could kill 100% of the human population.

disasters can kill billion or millions of us, but total eradication? **impossible**

let's explore what made other species extinct:

* Most animals went extinct because of **competition** from other species which fortunately/sadly we don't face. The amount of animals that we're pushing to extinction is insane, but the reverse doesn't happen anywhere on earth
* Extremely few **pathogens** have 100% mortality, but those ones usually spread with difficulty, like HIV, rabies( by blood), the transmission rate is negatively correlated with mortality. also, the most developed countries would be successful at containing them, like South Korea, Germany showed us recently
* **global warming could kill billions, but wouldn't eradicate us**. We know from geological data that the Earth was much warmer at some point, and while it DID have a negative effect on mammals, most of them survived. Siberia and Greenland could sustain the remains of the human race. Billionaires could build the equivalent of space colonies
* **WW3? could kill billions, but can't seem to end us**. Nazi Germany and the Soviet Union were evilest regimes in human history, and yet they went away rather quickly. Nazi Germany lasted 12 years, while the Soviet Union lasted 69 years
* Other sources of extinction would be volcanic eruptions, asteroids, etc. but **natural mass extinctions** happen so rarely, once in 100 million years basically. We haven't detected yet an asteroid or supervolcano that is about to hit us this century, apart from Yellowstone, but last time Yellowstone erupted humans didn't go extinct
* **nuclear Armaggedon?** people keep prophecizing it from the 60s, and many people have lived their entire life in the fear of it happening. MAD doctrine, ensured that nuclear states don't go to war with each other, for fear of retaliation.",2020-05-25 14:53:26,changemyview
CMV: Medication to treat mental health should be a final option that's only utilized when all other sensible options are exhausted.,"In the US we have an issue improper treatment of mental illnesses. This is because doctors will throw medication to treat the problem a patient has but then the patient doesn't work towards fixing the problem and develops a dependance.

Now some doctors and patients do carry some of the blame for that the biggest problem is that it is often cheaper to just get a prescription than to treat a problem and insurance will take the cheapest option. But this is not a discussion about healthcare and insurance.

I have an education background in psychology and mental health, nothing major but enough to actually have a grasp on the subject better than the average person and couple that with my own mental health issues that I have found ways to handle has made me come to the conclusion that most cases of mental illness can be treated without medication. 

There are of course the extreme cases caused by serious chemical imbalances that are physiological and unaffected by outside sources that will need medication to be treated.

But a good number of mental illnesses are the product of society and life. People do have chemical imbalances that are significant enough to bring about depression anxiety and the like but not so bad that they need medication to be treated. Therapy and changes of one's life such as finding new hobbies and interests looking up good things that happened in the world rather than just focusing on the bad and cutting the toxic and dangerous people out of your life can get people to a point where they're no longer affected by their mental illnesses or at least give them to a level that they can dip down to a bad point and still be able to get back up on their own.

Some people can handle this on their own but a lot of them do need help a support group a therapist something to help them reach this point but I wholeheartedly believe it's completely doable without medication. The both doctor and patient need to be willing to put in the work.

I'll even concede that medicated therapy with the whole purpose of weaning someone off the medication the point where they won't need it anymore is a very viable option but trying to put somebody on antidepressants or anti-anxiety medication for life when they don't need that is terrible.

By no means do I think this is easy and in my own life I handled it alone and it took me significantly longer then it should have if I had a support group that I opened up to but it's still possible even alone. And I believe most people can do it.

And cuz I know people will wonder I don't consider marijuana to be medication because while it isn't it drug and I can treat these symptoms I don't classified as medication because of its lack of addictive properties and the danger that other medications cause. So marijuana is something that people who are dealing with a mental illness can consider because it is a viable option to help calm their mind and regain control of it.",2020-05-25 14:28:40,changemyview
"CMV: If I only have the choice between Biden and Trump, I should support Biden in the 2020 GE.","Reasons why in no particular order

1. SCJ pick.  A Biden admin will likely pick a SCJ closer to RBG than Kavanaugh, which would bring more balance to the court than if Trump gets to nominate a SCJ.  

2.  Biden is willing to increase taxes, which could be used in multiple ways, such as reducing the deficit and/or funding social programs.

3. Higher likelihood of healthcare reform under Biden than Trump.

4. Should the 25th amendment be invoked on either candidate, under Trump, we get uber religious and conservative Pence until 2024.  Biden's VP will likely be groomed to be running in 2024 anyways, and we will likely get somebody less left wing than Pence is right wing.

For these reasons, although not limited to these 4 reasons, are why if I only have 2 choices, I should support Biden over Trump.",2020-05-25 14:25:06,changemyview
